[
  {
    "source_id": "FR-SRC-0001",
    "domain": "constitutional",
    "institution": "Légifrance",
    "title": "Constitution du 4 octobre 1958 — texte en vigueur",
    "date": "2026-08-12",
    "source_type": "legal_text",
    "authority": "PRIMARY",
    "priority": "A0",
    "refresh": "event_driven",
    "power_dimensions": "legal;institutional;rights",
    "use": "constitutional powers; rights; pluralism; law/regulation boundary",
    "status": "VERIFIED",
    "url": "https://www.legifrance.gouv.fr/loda/id/JORFTEXT000000571356/",
    "notes": "Snapshot must use version applicable on 2026-08-12."
  },
  {
    "source_id": "FR-SRC-0002",
    "domain": "constitutional",
    "institution": "Légifrance",
    "title": "Bloc de constitutionnalité",
    "date": "2026-08-12",
    "source_type": "legal_corpus",
    "authority": "PRIMARY",
    "priority": "A0",
    "refresh": "event_driven",
    "power_dimensions": "rights;legal;judicial",
    "use": "fundamental rights baseline and constitutional review",
    "status": "VERIFIED",
    "url": "https://www.legifrance.gouv.fr/contenu/menu/droit-national-en-vigueur/constitution",
    "notes": "Includes DDHC 1789, 1946 preamble, environmental charter."
  },
  {
    "source_id": "FR-SRC-0003",
    "domain": "institutions",
    "institution": "Vie-publique",
    "title": "Institutions de l'État",
    "date": "2026-08-12",
    "source_type": "institutional_reference",
    "authority": "OFFICIAL_SECONDARY",
    "priority": "A0",
    "refresh": "continuous",
    "power_dimensions": "executive;legislative;institutional",
    "use": "institutional map and role descriptions",
    "status": "VERIFIED",
    "url": "https://www.vie-publique.fr/institutions-de-letat",
    "notes": "Use for structure/context, not as substitute for legal texts."
  },
  {
    "source_id": "FR-SRC-0004",
    "domain": "territorial",
    "institution": "Vie-publique",
    "title": "Collectivités territoriales — structure and competences",
    "date": "2026-01-22",
    "source_type": "institutional_reference",
    "authority": "OFFICIAL_SECONDARY",
    "priority": "A0",
    "refresh": "event_driven",
    "power_dimensions": "territorial;administrative;fiscal",
    "use": "local-government autonomy and competences",
    "status": "VERIFIED",
    "url": "https://www.vie-publique.fr/fiches/19604-quest-ce-quune-collectivite-territoriale-ou-collectivite-locale",
    "notes": "Avoid local-to-national extrapolation."
  },
  {
    "source_id": "FR-SRC-0010",
    "domain": "macro_public_finance",
    "institution": "INSEE",
    "title": "Comptes nationaux annuels 2025",
    "date": "2026-05-29",
    "source_type": "official_statistics",
    "authority": "PRIMARY_STATISTICAL",
    "priority": "A0",
    "refresh": "annual",
    "power_dimensions": "economic;fiscal",
    "use": "GDP and national-account denominator",
    "status": "VERIFIED",
    "url": "https://www.insee.fr/fr/statistiques/8988793",
    "notes": "2025 GDP: base for snapshot."
  },
  {
    "source_id": "FR-SRC-0011",
    "domain": "macro_public_finance",
    "institution": "INSEE",
    "title": "Dépenses et recettes publiques 2025",
    "date": "2026-05-29",
    "source_type": "official_statistics",
    "authority": "PRIMARY_STATISTICAL",
    "priority": "A0",
    "refresh": "annual",
    "power_dimensions": "fiscal;economic",
    "use": "public expenditure, receipts, debt, compulsory levies",
    "status": "VERIFIED",
    "url": "https://www.insee.fr/fr/statistiques/2381414",
    "notes": "Fiscal footprint is not direct-control proxy."
  },
  {
    "source_id": "FR-SRC-0012",
    "domain": "macro_public_finance",
    "institution": "INSEE",
    "title": "Dépenses publiques par fonction",
    "date": "2026-02-05",
    "source_type": "official_statistics",
    "authority": "PRIMARY_STATISTICAL",
    "priority": "A0",
    "refresh": "annual",
    "power_dimensions": "fiscal;social;health",
    "use": "functional distribution of public spending",
    "status": "VERIFIED",
    "url": "https://www.insee.fr/fr/statistiques/8735252",
    "notes": "Separate financing from ownership/service provision."
  },
  {
    "source_id": "FR-SRC-0013",
    "domain": "social_protection",
    "institution": "INSEE",
    "title": "Protection sociale — France portrait social 2025",
    "date": "2025-11-18",
    "source_type": "official_statistics",
    "authority": "PRIMARY_STATISTICAL",
    "priority": "A0",
    "refresh": "annual",
    "power_dimensions": "social;fiscal",
    "use": "social-protection flows and beneficiary structure",
    "status": "VERIFIED",
    "url": "https://www.insee.fr/fr/statistiques/8612542",
    "notes": "Do not infer corporatism from welfare spending."
  },
  {
    "source_id": "FR-SRC-0014",
    "domain": "health_finance",
    "institution": "INSEE",
    "title": "Dépenses de santé — France portrait social 2025",
    "date": "2025-11-18",
    "source_type": "official_statistics",
    "authority": "PRIMARY_STATISTICAL",
    "priority": "A0",
    "refresh": "annual",
    "power_dimensions": "health;fiscal",
    "use": "public/private health financing split",
    "status": "VERIFIED",
    "url": "https://www.insee.fr/fr/statistiques/8612570",
    "notes": "Financing share ≠ provider ownership."
  },
  {
    "source_id": "FR-SRC-0020",
    "domain": "state_ownership",
    "institution": "Agence des participations de l'État",
    "title": "Les entreprises de l'APE",
    "date": "2026-06-30",
    "source_type": "official_portfolio",
    "authority": "PRIMARY",
    "priority": "A0",
    "refresh": "continuous",
    "power_dimensions": "ownership;governance;economic",
    "use": "direct state equity-control graph",
    "status": "VERIFIED",
    "url": "https://www.economie.gouv.fr/agence-participations-etat/comprendre-lape/les-entreprises-de-lape",
    "notes": "Ownership must remain separate from regulation and subsidies."
  },
  {
    "source_id": "FR-SRC-0021",
    "domain": "state_ownership",
    "institution": "Agence des participations de l'État",
    "title": "Doctrine actionnariale de l'État",
    "date": "2026-08-12",
    "source_type": "official_policy",
    "authority": "PRIMARY",
    "priority": "A0",
    "refresh": "event_driven",
    "power_dimensions": "ownership;governance",
    "use": "purpose and governance of state shareholdings",
    "status": "VERIFIED",
    "url": "https://www.economie.gouv.fr/agence-participations-etat/strategie-actionnariale/notre-doctrine",
    "notes": "Policy statement is not evidence of operational control in each company."
  },
  {
    "source_id": "FR-SRC-0022",
    "domain": "corporate_registry",
    "institution": "INPI",
    "title": "Registre national des entreprises / DATA INPI",
    "date": "2026-08-12",
    "source_type": "official_registry",
    "authority": "PRIMARY",
    "priority": "A0",
    "refresh": "continuous",
    "power_dimensions": "ownership;corporate;governance",
    "use": "legal entities, officers, filings, ownership-chain inputs",
    "status": "VERIFIED",
    "url": "https://data.inpi.fr/",
    "notes": "Beneficial-owner access is restricted; ultimate-control graph may require additional lawful sources."
  },
  {
    "source_id": "FR-SRC-0023",
    "domain": "corporate_registry",
    "institution": "INPI",
    "title": "Bénéficiaires effectifs — conditions d'accès",
    "date": "2025-01-16",
    "source_type": "official_registry_rules",
    "authority": "PRIMARY",
    "priority": "A0",
    "refresh": "event_driven",
    "power_dimensions": "ownership;transparency",
    "use": "access limitations for ultimate-beneficial-owner data",
    "status": "VERIFIED",
    "url": "https://www.inpi.fr/ressources/formalites-dentreprises/beneficiaires-effectifs",
    "notes": "Explicit limitation in data-access plan."
  },
  {
    "source_id": "FR-SRC-0024",
    "domain": "corporate_structure",
    "institution": "INSEE",
    "title": "Tissu productif français par catégorie d'entreprises et type de contrôle",
    "date": "2025-12-10",
    "source_type": "official_statistics",
    "authority": "PRIMARY_STATISTICAL",
    "priority": "A0",
    "refresh": "annual",
    "power_dimensions": "economic;ownership;concentration",
    "use": "large groups, ETI, foreign-control structure",
    "status": "VERIFIED",
    "url": "https://www.insee.fr/fr/statistiques/8675639",
    "notes": "Macro structure; not individual-group ownership."
  },
  {
    "source_id": "FR-SRC-0025",
    "domain": "foreign_control",
    "institution": "INSEE",
    "title": "Emploi en France sous contrôle étranger en 2023",
    "date": "2025-11-27",
    "source_type": "official_statistics",
    "authority": "PRIMARY_STATISTICAL",
    "priority": "A1",
    "refresh": "annual",
    "power_dimensions": "ownership;employment;external",
    "use": "foreign-control exposure",
    "status": "VERIFIED",
    "url": "https://www.insee.fr/fr/statistiques/8671743",
    "notes": "Use as structural denominator."
  },
  {
    "source_id": "FR-SRC-0026",
    "domain": "corporate_finance",
    "institution": "Banque de France",
    "title": "Fichier bancaire des entreprises (FIBEN)",
    "date": "2025-04-14",
    "source_type": "official_database",
    "authority": "PRIMARY",
    "priority": "A1",
    "refresh": "continuous",
    "power_dimensions": "finance;credit;corporate",
    "use": "financing relationships, credit exposures, financial links",
    "status": "VERIFIED",
    "url": "https://www.banque-france.fr/fr/a-votre-service/banques-assurances-prestataires-fiduciaires/fichier-bancaire-entreprises-fiben",
    "notes": "Access constraints apply; use public statistics where direct access unavailable."
  },
  {
    "source_id": "FR-SRC-0030",
    "domain": "banking",
    "institution": "ACPR",
    "title": "Marché français de la banque et de l'assurance 2024",
    "date": "2025-10-23",
    "source_type": "official_statistics",
    "authority": "PRIMARY_REGULATORY",
    "priority": "A0",
    "refresh": "annual",